{
  "schema_version": "aud-finding-v1",
  "id": "F-2026-09-04-flow-001",
  "run_id": "RUN-2026-09-04-001",
  "source_audit": "flow-audit",
  "category": "navigation.context-preservation",
  "type": "symptom",
  "title": "Comparison state is lost after evidence drill-down",
  "statement": "Returning from evidence detail resets the selected source and scroll anchor.",
  "locations": [{ "route": "/compare", "surface": "comparison", "component": "EvidenceLink", "state": "source-selected", "viewport": "1280x800" }],
  "task_refs": ["TASK-03"],
  "affected_personas": ["researcher"],
  "affected_areas": ["ux", "navigation"],
  "evidence_refs": ["EV-014"],
  "severity": { "level": 3, "rationale": "Users repeatedly lose completed comparison work." },
  "confidence": { "score": 0.91, "basis": "Reproduced in three browser runs." },
  "reach": "journey",
  "frequency": "common",
  "urgency": "high",
  "native_metrics": { "flow_impact": 0.84, "structural_floor": 3 },
  "root_cause_hypothesis": null,
  "recommendation": { "action": "Preserve selection, filters, and scroll anchor.", "alternatives": [], "estimated_effort": "M", "change_risk": "medium" },
  "acceptance_criteria": [{ "id": "AC-001", "statement": "Returning from evidence detail restores selection and scroll anchor." }],
  "verification_method": [{ "instrument": "browser", "procedure": "Replay the drill-down and return path with the mature fixture." }],
  "relationships": { "duplicates": [], "reinforces": [], "contradicts": [], "depends_on": [], "blocks": [], "caused_by": [] },
  "status": "open"
}
